{
  "schema_version": 1,
  "cycle_id": "20260927-c1",
  "status": "IN_PROGRESS",
  "started_at": "2026-09-27T21:26:02Z",
  "ended_at": null,
  "duration_review_min": null,
  "duration_cycle_min": null,
  "cadence": {
    "trigger": {
      "kind": "version_bumps",
      "every": 5,
      "note": ""
    },
    "boundary": {
      "ref": null,
      "at": null,
      "pattern": "^v[0-9]+\\.[0-9]+\\.[0-9]+ ACCEPTED",
      "accepted_since": 0
    },
    "fires": false,
    "evaluated_at": "2026-09-27T21:26:02Z"
  },
  "corpus": {
    "hash": null,
    "pack": null,
    "pack_status": "absent"
  },
  "lenses": {
    "A": {
      "status": "PENDING",
      "report_path": null,
      "sha256": null,
      "verdict": null,
      "receipt": null,
      "fallback": null,
      "recorded_at": null,
      "reason": null
    },
    "B": {
      "status": "PENDING",
      "report_path": null,
      "sha256": null,
      "verdict": null,
      "receipt": null,
      "fallback": null,
      "recorded_at": null,
      "reason": null
    },
    "G": {
      "status": "PENDING",
      "report_path": null,
      "sha256": null,
      "verdict": null,
      "receipt": null,
      "fallback": null,
      "recorded_at": null,
      "reason": null
    },
    "J": {
      "status": "PENDING",
      "report_path": null,
      "sha256": null,
      "verdict": null,
      "receipt": null,
      "fallback": null,
      "recorded_at": null,
      "reason": null
    },
    "P": {
      "status": "PENDING",
      "report_path": null,
      "sha256": null,
      "verdict": null,
      "receipt": null,
      "fallback": null,
      "recorded_at": null,
      "reason": null
    },
    "C": {
      "status": "PENDING",
      "report_path": null,
      "sha256": null,
      "verdict": null,
      "receipt": null,
      "fallback": null,
      "recorded_at": null,
      "reason": null
    },
    "E": {
      "status": "PENDING",
      "report_path": null,
      "sha256": null,
      "verdict": null,
      "receipt": null,
      "fallback": null,
      "recorded_at": null,
      "reason": null
    },
    "F": {
      "status": "PENDING",
      "report_path": null,
      "sha256": null,
      "verdict": null,
      "receipt": null,
      "fallback": null,
      "recorded_at": null,
      "reason": null
    },
    "D": {
      "status": "PENDING",
      "report_path": null,
      "sha256": null,
      "verdict": null,
      "receipt": null,
      "fallback": null,
      "recorded_at": null,
      "reason": null
    },
    "H": {
      "status": "PENDING",
      "report_path": null,
      "sha256": null,
      "verdict": null,
      "receipt": null,
      "fallback": null,
      "recorded_at": null,
      "reason": null
    },
    "M": {
      "status": "PENDING",
      "report_path": null,
      "sha256": null,
      "verdict": null,
      "receipt": null,
      "fallback": null,
      "recorded_at": null,
      "reason": null
    },
    "T": {
      "status": "PENDING",
      "report_path": null,
      "sha256": null,
      "verdict": null,
      "receipt": null,
      "fallback": null,
      "recorded_at": null,
      "reason": null
    },
    "I": {
      "status": "PENDING",
      "report_path": null,
      "sha256": null,
      "verdict": null,
      "receipt": null,
      "fallback": null,
      "recorded_at": null,
      "reason": null
    },
    "S": {
      "status": "PENDING",
      "report_path": null,
      "sha256": null,
      "verdict": null,
      "receipt": null,
      "fallback": null,
      "recorded_at": null,
      "reason": null
    }
  },
  "waivers": [],
  "proposals": [
    {
      "id": "0001-promotion-close-row-gate",
      "source": "dir",
      "path": "/tmp/rr-f3/reviews/20260927-c1/proposals/0001-promotion-close-row-gate.md",
      "recorded_at": "2026-09-27T21:42:38Z",
      "op": "ADD",
      "target": "tests/",
      "dated": true
    },
    {
      "id": "0002-review-rotation-has-no-close-row",
      "source": "dir",
      "path": "/tmp/rr-f3/reviews/20260927-c1/proposals/0002-review-rotation-has-no-close-row.md",
      "recorded_at": "2026-09-27T21:42:38Z",
      "op": "CHANGE",
      "target": "evidence/ledger.jsonl",
      "dated": true
    },
    {
      "id": "0003-date-token-rejects-iso-instant",
      "source": "dir",
      "path": "/tmp/rr-f3/reviews/20260927-c1/proposals/0003-date-token-rejects-iso-instant.md",
      "recorded_at": "2026-09-27T21:42:38Z",
      "op": "CHANGE",
      "target": "tools/review.py:1525",
      "dated": true
    }
  ],
  "codification_plan": [
    {
      "finding": "DATE_TOKEN rejects the ISO-8601 instant form (fleet law's mandated dating form)",
      "disposition": "landed",
      "home": "tools/review.py DATE_TOKEN (commit 348f758)",
      "reason": null,
      "recorded_at": "2026-09-28T19:02:20Z"
    },
    {
      "finding": "the promotion has no ledger close row (no intake/claim/dispatch/close names it)",
      "disposition": "routed",
      "home": "evidence/ledger.jsonl - the close row this cycle's closure writes",
      "reason": null,
      "recorded_at": "2026-09-28T19:02:21Z"
    },
    {
      "finding": "no gate reads a promotion's close-row declarations (promotion=/naming=/review=/vocabulary= -> 0 files)",
      "disposition": "routed",
      "home": "tests/ - the promotion close-row gate the methodology lane lands with this cycle's close row",
      "reason": null,
      "recorded_at": "2026-09-28T19:02:21Z"
    },
    {
      "finding": "codification_plan was read and initialised but written by nothing, so the schema's own close condition could never be met",
      "disposition": "landed",
      "home": "tools/review.py cmd_codify (commit 6c4f42f)",
      "reason": null,
      "recorded_at": "2026-09-28T19:10:17Z"
    },
    {
      "finding": "close --status COMPLETED returned rc=0 over 14 PENDING lenses and over an accepted finding carrying no carrier, so the cycle reached a terminal state on unrun work",
      "disposition": "landed",
      "home": "tools/review.py cmd_close (commit 5b2fe9f)",
      "reason": null,
      "recorded_at": "2026-09-28T19:10:18Z"
    }
  ],
  "frozen_at": null,
  "inputs_snapshot": null,
  "step0_log": [
    {
      "at": "2026-09-27T21:31:36Z",
      "status": "IN_PROGRESS",
      "frozen": false,
      "completed": 0,
      "waived": 0,
      "pending": 14,
      "pending_lenses": [
        "A",
        "B",
        "G",
        "J",
        "P",
        "C",
        "E",
        "F",
        "D",
        "H",
        "M",
        "T",
        "I",
        "S"
      ],
      "next_action": "brief and record lens A (pending: A,B,G,J,P,C,E,F,D,H,M,T,I,S)"
    },
    {
      "at": "2026-09-27T21:42:54Z",
      "status": "IN_PROGRESS",
      "frozen": false,
      "completed": 0,
      "waived": 0,
      "pending": 14,
      "pending_lenses": [
        "A",
        "B",
        "G",
        "J",
        "P",
        "C",
        "E",
        "F",
        "D",
        "H",
        "M",
        "T",
        "I",
        "S"
      ],
      "next_action": "brief and record lens A (pending: A,B,G,J,P,C,E,F,D,H,M,T,I,S)"
    }
  ],
  "updated_at": "2026-09-28T19:10:18Z"
}
